{
  "$schema": "./dataset-manifest.schema.json",
  "format": "forgex-dataset-manifest",
  "version": 1,
  "id": "forgex-print-farm-400",
  "title": "FORGE·X virtual print farm — 400 jobs",
  "description": "Deterministic physics simulation of 400 print jobs across eight virtual FDM machines, with per-job telemetry.",
  "provenance": "simulation",
  "license": "Apache-2.0",
  "source": {
    "type": "generator",
    "path": "tools/farm-sim.js",
    "command": "node tools/farm-sim.js --machines 8 --jobs 400 --seed 20260726 --out contracts/datasets/print_farm_400.csv --json contracts/datasets/print_farm_400_telemetry.json",
    "seed": 20260726
  },
  "privacy": {
    "containsPersonalData": false,
    "anonymized": false,
    "note": "All machine IDs, orders and telemetry were generated by the simulator; no production or personal data is present."
  },
  "files": [
    {
      "path": "contracts/datasets/print_farm_400.csv",
      "role": "table",
      "mediaType": "text/csv",
      "sha256": "85f09e4594b10a4dac914c05c3b2ece227b5b181617e17c13d4d9203179888fd",
      "rows": 400,
      "columns": [
        "job_id",
        "date",
        "machine_id",
        "model_name",
        "material",
        "layer_height_mm",
        "duration_min",
        "filament_g",
        "cost_fen",
        "status",
        "fail_reason",
        "energy_kwh"
      ]
    },
    {
      "path": "contracts/datasets/print_farm_400_telemetry.json",
      "role": "telemetry",
      "mediaType": "application/json",
      "sha256": "d5515f3affadd4f4d37dc69c1b9a0268aa527eee74cfbd32c619ccac0f054f59"
    }
  ]
}
